video_id,title,publishedAt,channelId,channelTitle,categoryId,trending_date,tags,view_count,likes,dislikes,comment_count,thumbnail_link,comments_disabled,ratings_disabled,description
"LhYfsKc0_tA","REWIND INDONESIA 2020","2020-12-28T12:45:10Z","UC-z1ubmS-iHMVr83EEwRS2g","Indonesian Youtubers","22","21.04.01","[none]","21135301","3266878","33467","440862","https://i.ytimg.com/vi/LhYfsKc0_tA/default.jpg","False","False","Rewind Indonesia 2020. #RI2020Directed by: Chandra Liow & AulionInitiated by: Andovi da Lopez, Jovial da Lopez, Chandra Liow, Aulion, & Nessie Judge.This rewind is not affiliated in anyway with YouTube or Google as a company. This rewind was made by Indonesian creators, from Indonesian creators, for the Indonesian people with the sole purpose of uniting our community and ending the year 2020 with something hopeful and positive.No copyright infringement intended. Thank you. Love you all.OCBC NISP bangga menjadi bagian dari Rewind Indonesia 2020. Video ini menunjukkan bahwa dalam segala keterbatasan, anak-anak muda Indonesia tetap mampu berkarya dengan berbekal spirit Tidak Ada Yang Tidak Bisa. Salah satu pesan yang ingin disampaikan melalui video ini adalah kesadaran finansial sejak muda, seperti menabung dan berinvestasi dengan nominal berapa saja, misalnya mulai Rp20 ribu per hari. Join layanan Nyala by OCBC NISP dan ikuti program #Save20 untuk dapatkan cashback 200rb PLUS  eksklusif T-shirt rewind 2020, kolaborasi Nyala x Monstore dengan kode promo NyalaXRewind, hanya untuk 300 pendaftar pertama!Nyalakan mimpimu sekarang, karena Tidak Ada Yang Tidak Bisa. #TAYTBWe, from the Rewind Indonesia 2020 team respect all the creators and artists that are in this video. And we appreciate all the music and art that is in this video. But we, too, may have missed a few important points/reference in the process of creating this Rewind. Thank you for reminding us! Additional Song Credit:“Lover” 2:03-2:06 — Taylor SwiftProduced by Taylor Swift, Jack AntonoffWritten by Taylor Swift"
"VpdGXL4ZHvU","Akhirnya ATTA NUR Bertemu berlinang air mata...","2021-01-02T04:00:15Z","UCaKLg1ELiX0zTJ6Je3c5esA","Atta Halilintar","24","21.04.01","[none]","2399840","192255","8894","60582","https://i.ytimg.com/vi/VpdGXL4ZHvU/default.jpg","False","False","Instagram : @attahalilintarFacebook : Atta Halilintar tiktok : @attahalilintartwitter : @attahalilintarAll about business inquiries :attahalilintar.business@gmail.com"
"HDMrH7UjKLY","NANGIS TERHARU, AUREL KEDATANGAN ATTA DI MALAM TAHUN BARU","2021-01-02T11:28:25Z","UCb9-JNR7ljCLTc2h5gVDcJg","Aurelie Hermansyah","24","21.04.01","Aurelie Hermansyah|Aurel Hermansyah|aurel|the hermansyah a6|keluarga hermansyah|keluarga asix|atta halilintar|atta aurel|infotainment|berita artis indonesia|berita selebritis|viral|video viral|trending|Aurel Atta|tahun baru|new year|couples|pasangan harmonis|pasangan ideal|new normal|trends|global|happiness|covid19|Nangis|Nangis Terharu|Terharu|Aurel Atta Trending","1424398","105267","1643","26185","https://i.ytimg.com/vi/HDMrH7UjKLY/default.jpg","False","False","#Couples #NewYear #Happiness #OnTrending Pergantian Tahun Baru menjadi suatu momen spesial penting bagi Aurel. Mengapa Tidak ? Kedatangan Atta yang ikut merayakan Tahun Baru menjadi saksi bisu. Penasaran kan ? Mari kita tonton sama-sama aja yuk, daripada makin penasaran. Have a great day :) JANGAN LUPA LIKE, SHARE AND SUBSCRIBE YAA GUYS. HAPPY WATCHING ;)Follow Instagram : https://www.instagram.com/aurelie.hermansyah/?hl=enFor Business Inquiries/Endorse. : hijaufilm.management@gmail.comor click https://linktr.ee/thehermansyaha6MUSIC BACKSOUND :––––––––––––––––––––––––––––––Skydancer by Scandinavianz https://soundcloud.com/scandinavianzCreative Commons — Attribution 3.0 Unported — CC BY 3.0Free Download / Stream: https://bit.ly/_skydancerMusic promoted by Audio Library https://youtu.be/Kp-eibuQpWg––––––––––––––––––––––––––––––––––––––––––––––––––––––––––––JayJen - Happy Moments by JayJen Music https://soundcloud.com/jayjenmusicCreative Commons — Attribution 3.0 Unported  — CC BY 3.0 Free Download: http://bit.ly/HappyMoments-JayJenMusic promoted by Audio Library https://youtu.be/ivlB5cyqGsU––––––––––––––––––––––––––––––"
"eRyF8GtSF10","Amanda Manopo ANDIN - Tanpa Batas Waktu TBW (Cover)","2020-12-29T10:00:09Z","UCoinOCKncGXFYvKQBxzgD5w","Ade Nurulianto","10","21.04.01","[none]","5834681","338342","6840","48229","https://i.ytimg.com/vi/eRyF8GtSF10/default.jpg","False","False","Selamat menikmati lagu #TanpaBatasWaktu yang dibawakan apik oleh Amanda Manopo (Andin). Dan lagu ini juga belakangan semakin terdengar dimana mana dan di semua kalangan berkat sinetron “Ikatan Cinta” juga yang ratingnya menjadi rating tertinggi sinetron yang pernah ada di Indonesia. Jadi untuk semua PERINDU di seluruh Indonesia dan juga pasukan penikmat sinetron Ikatan Cinta selamat memasuki Waktu Indonesia Bagian TBW!Official MV Tanpa Batas Waktu : https://youtu.be/4Yz-F0PtwSUJangan lupa streaming lagunya disini:LangitMusik     : https://bit.ly/TBWLangitMusikJOOX                 : https://bit.ly/TBWJOOXApple Music     : https://bit.ly/TanpaBatasWaktuSpotify               : https://bit.ly/TBWSpotifyYoutube Music : https://youtu.be/4Yz-F0PtwSUSong Credit :Music Produser & composed by : Ade GovindaPiano, Keys : @RioRocardoKeys etc : Ade GovindaMixed by Jones RomaVideo by Ade Govinda & @nandalove1986Follow sosmed nya ya!!Twitter  : https://twitter.com/ade_govinda Instagram : https://www.instagram.com/ade_govinda/ Facebook : https://www.facebook.com/adenurulianto01 YouTube : https://www.youtube.com/user/Adenurulianto TikTok  : https://vt.tiktok.com/UTnygu/ Business Inquiry /Contact PersonEmail : patty@creativeindigo.net"
"q08xq_3Ub74","KESERUAN TAHUN BARU DI KELUARGA MAK BETI","2020-12-31T08:59:49Z","UCfx3oPv3cJm2aCJ7UnhKx8A","Arif muhammad","23","21.04.01","arif muhammad|mak beti|ma beti|mama beti|mamak beti|keluarga beti|betizen|tahun baru 2021|tahun baru|2021|happy new year|sketsa|sitkom|web series|short movie|kembang api|kemping|malam tahun baru|medan|legat medan|melayu|karo|batak|jawa","2809357","111939","3530","8245","https://i.ytimg.com/vi/q08xq_3Ub74/default.jpg","False","False","Find me on sosial media :Instagram : https://www.instagram.com/arifmuhammaddd_/facebook : http://www.facebook.com/arifmuhammadddsubscribe channel Betizen : https://www.youtube.com/betizenpengisi VOinstagram : https://www.instagram.com/ceritajimmy/for bussines Email: arifmuhammadd35@gmail.com"
"gvmUznD8Y0Y","GADING CERITA APA AJA KE ROY MARTEN TENTANG KASUS GISEL! | RUMPI (30/12/20) P1","2021-01-01T12:41:23Z","UCIohHXwCEKxWCLvAguJ-GjA","TRANS TV Official","24","21.04.01","#NontonRumpiSamaSaya #SantuySamaSaya #NontonTransTV","1724777","29177","1236","3580","https://i.ytimg.com/vi/gvmUznD8Y0Y/default.jpg","False","False","RUMPI=== TAYANG SETIAP SENIN - JUM'AT PUKUL 14.00 WIB===PART 1: https://youtu.be/gvmUznD8Y0YPART 2: https://youtu.be/upnVMzvQS3sPART 3: https://youtu.be/N-pIWn8T6LMPART 4: https://youtu.be/JTxWZcC6N18===Kumpulan video semua peristiwa selebritis terkenal dibahas apa adanya. Lalu semua dibahas dan disingkap tanpa rahasia, langsung dari sumber terpecaya, bersama Feny Rose yang selalu membahana.===WEBSITE - http://www.transtv.co.idTWITTER - https://twitter.com/TRANSTV_CORPFACEBOOK - https://www.facebook.com/TransTVMediaINSTAGRAM - https://www.instagram.com/TRANSTV_CORP#SantuySamaSaya #NontonRumpiDiTransTV #Rumpi30Desember2020"
"TPlLChG1hAM","BOCIL NANGIS AKUNNYA DIHACK ORANG  |  REACTION EDITOR BERKELAS PRIPAYER PART 1","2020-12-30T02:52:51Z","UCXT5s05a6LQsP9q83W5hY_A","WAWAN MKS","20","21.04.01","Wawan|mks|wawanmks|freefire|booyah|freefireindonesia|nesc|nescind|nescid|esport|auraesport|auranesc|trending|gamers|gaming|youtuber|youtubergaming|freefirebrazil|freefirethailand|freefirekocak|funnymomentfreefire|headshoot|awm|m79|shotgun|jumpshoot|ngebug|ngecheat","2464620","215410","6915","17818","https://i.ytimg.com/vi/TPlLChG1hAM/default.jpg","False","False","kasih tau gue klo ada video keren buat gua reaction ya!! dengan cara ketik di kolom komentar / judul postingan video tersebut :#editorberkelaswawanmks"
"K2Oo7mQWzqY","Ironis! Video Panas Gisella Anastasia Terjadi Sebelum Bercerai dari Gading Marten - Cumicam","2020-12-30T04:06:45Z","UC5A_pdnOOcMsaBzFAHiTMLg","Cumicumi","24","21.04.01","infotainment|gosip|artis|selebriti|Berita selebritis|gosip terbaru hari ini|berita selebritis terbaru|info selebritis","3652802","34638","3305","14320","https://i.ytimg.com/vi/K2Oo7mQWzqY/default.jpg","False","False","Kumpulan video berita gosip terlengkap, terhangat dan terbaru hari ini seputar selebritis IndonesiaLangsung aja klik http://www.cumicumi.com/------web: http://www.cumicumi.com/facebook: http://www.facebook.com/CumiCumiDotComtwitter: https://twitter.com/CumiTweetGoogle+: https://plus.google.com/u/0/107561674912304174647"
"P_XCfUAu5dc","ATTA TERBUKA MENGENAI HUBUNGNANYA SAMA AUREL,PERBEDAAN PRINSIP ⁉️","2021-01-02T05:50:57Z","UCgL67Yp0NH9-XOKA6C-gs7Q","DEWI PERSSIK","22","21.04.01","[none]","637965","36356","570","4992","https://i.ytimg.com/vi/P_XCfUAu5dc/default.jpg","False","False","#DEWIPERSSIK #ATTAHALILINTAR #AURELAtta jujur tetang perasaannya terhadap Aurel, apa penyebab hubungannya saat ini renggang?? penasaran, pantengin terus videonya dan jangan sampe di skip yaa..."
"sNRfEAqfFEI","HIGHLIGHTS | Tierney, Saka and Laca all find the net! | West Brom 0-4 Arsenal | Premier League","2021-01-03T00:01:13Z","UCpryVRk_VDudG8SHXgWcG0w","Arsenal","17","21.04.01","Arsenal|Arsenal FC|Arsenal Football Club|Football|Club|EPL|Premier League|Soccer|Sport|Team|aubameyang|lacazette|bernd leno|Mesut ozil|bellerin|hector bellerin|dani Ceballos|Kieran Tierney|willian|granit xhaka|gabriel martinelli|bukayo saka|Thomas partey|Gabriel Magalhaes|William Saliba|David Luiz|Nicolas Pepe|arsenal highlights|arsenal training|mikel arteta","1165555","23775","753","1562","https://i.ytimg.com/vi/sNRfEAqfFEI/default.jpg","False","False","Watch the highlights of our four-goal win over West Bromwich Albion and Sam Allardyce at The Hawthorns, which made it three Premier League wins in a row.#arsenal #arsenalhighlights #premierleague--Enjoy match highlights, training and behind the scenes to get closer to the likes of Pierre-Emerick Aubameyang, David Luiz, Vivianne Miedema, Nicolas Pepe, Alexandre Lacazette, Leah Williamson, Mesut Ozil, Bernd Leno, Danielle van de Donk, Willian, Hector Bellerin, Jordan Nobbs, Bukayo Saka, Kim Little, Gabriel Martinelli, Thomas Partey and more.Subscribe to the Official Arsenal YouTube Channel: https://arsn.al/youtubeFollow us on Facebook: https://arsn.al/facebookFollow us on Twitter: https://arsn.al/twitterFollow us on Instagram: https://arsn.al/instagramFollow us on TikTok: https://arsn.al/tiktokThis is the Official YouTube channel for Arsenal Football Club.For more match action, highlights and training videos, make sure you become a digital member and sign up to Arsenal Player. It's FREE and is the Home of the Game: https://arsn.al/arsenalplayerArsenal Football Club were formed in 1886 and amassed 13 League titles, 14 FA Cups. Some of their greatest players include: Thierry Henry, Dennis Bergkamp, Tony Adams, Ian Wright, Robert Pires, Liam Brady, Patrick Vieira, Cliff Bastin and Charlie George."
"tLjUSzr2EYQ","TANTANGAN HAMIL 24 JAM || Momen Kehamilan Kocak oleh 123 GO!","2020-12-31T14:00:16Z","UC43nz9qnZ7AIrbOlfxejTig","123 GO! Indonesian","26","21.04.01","jail|123go|kerajinan|123go!|kejailan|tutorial|kiat|swakriya|lucu|seru|123 go|ramah|tantangan-tantangan|teman|tantangan|cara|kerajinan-kerajinan|kejailan-kejailan","1867523","19730","2184","1244","https://i.ytimg.com/vi/tLjUSzr2EYQ/default.jpg","False","False","BERLANGGANAN http://bit.ly/2CD26zLPenasaran bagaimana rasanya hamil selama 24 jam? Kalau mau cobain, tulis di kolom komentar, ya!Dan jangan lupa share video ini dengan teman-temanmu dan subscribe channel YouTube 123 Go! untuk video seru lainnya seperti ini! #123GO #lucu #komedi#123GO! #lucu Musik oleh Epidemic Sound: https://www.epidemicsound.com/ Sampel Foto: https://www.depositphotos.com https://www.shutterstock.comVideo ini ditujukan sebagai hiburan. Kami tidak menjamin kelengkapan, keamanan, dan kelayakan apa pun. Segala tindakan yang dilakukan berdasarkan informasi di video ini akan sepenuhnya menjadi risiko pelaku, dan kami tidak akan bertanggung jawab atas segala kerusakan dan kehilangan. Pemirsa bertanggung jawab penuh untuk menilai, merawat, dan melakukan tindak pencegahan jika berencana untuk meniru.Video berikut ini mungkin menampilkan aktivitas yang dilakukan oleh aktor-aktor kami dalam lingkungan terkendali - mohon bertindak penuh pertimbangan, kewaspadaan, dan kehati-hatian apabila hendak meniru."
"lz_3NS7gIz8","TANTANGAN MAKANAN ASLI VS COKELAT || 24 JAM Makan Makanan Manis! Tes Rasa Seru oleh 123 GO! BOYS","2020-12-23T04:00:06Z","UCmWPgDvrvP_svfJ1F40L3Vw","123 GO! BOYS Indonesian","26","21.04.01","123go|cowok|kiathidup|lucu|123goboys|diy|prank|tantangan|123go!boys","16851384","82469","33780","8191","https://i.ytimg.com/vi/lz_3NS7gIz8/default.jpg","False","False","Doyan cokelat? Ayo kita uji! Silakan tonton tantangan makanan asli versus cokelat ini!Kamu tipe orang yang jauh lebih suka cokelat dibanding apa pun? Bahkan kodok ajaib? Doyan? Tantang teman-temanmu dalam tantangan cokelat buatanmu sendiri dan beri tahu kami bagaimana hasilnya!Subscribe channel YouTube kami supaya kamu tidak ketinggalan video-video baru!#123GO #tantangan #prankBerlangganan: https://bit.ly/2yuvmtUMusik oleh Epidemic Sound: https://www.epidemicsound.com/Materi stok: https://www.depositphotos.com https://www.shutterstock.comVideo ini ditujukan sebagai hiburan. Kami tidak menjamin kelengkapan, keamanan, dan kelayakan apa pun. Segala tindakan yang dilakukan berdasarkan informasi di video ini akan sepenuhnya menjadi risiko pelaku, dan kami tidak akan bertanggung jawab atas segala kerusakan dan kehilangan. Pemirsa bertanggung jawab penuh untuk menilai, merawat, dan melakukan tindak pencegahan jika berencana untuk meniru.Video berikut ini mungkin menampilkan aktivitas yang dilakukan oleh aktor-aktor kami dalam lingkungan terkendali - mohon bertindak penuh pertimbangan, kewaspadaan, dan kehati-hatian apabila hendak meniru."
"W8qKu9jR8n8","BORONG BUS BEKAS MURAH BANGET, EX PO SUMBER ALAM!!","2020-12-28T09:49:18Z","UCGAGPNod17fLs8blfuev4hA","Ridwan Hanif Rahmadi","2","21.04.01","Bis|bus|beli bis|beli bus|bus rongsok|rongsokan|bis rumah|bus rumah","2673134","34015","3025","4004","https://i.ytimg.com/vi/W8qKu9jR8n8/default.jpg","False","False","Untuk teman teman yang mau beli bis bekas bisa langsung hubungi pak Jajang di 087837712252Setelah menonton, jangan lupa klik tombol subscribe diatas dan nyalakan lonceng untuk notifikasi video terbaru langsung dari HP anda!Jangan lupa untuk follow akun Instagram Ridwan Hanif di @ridwanhrhttps://www.instagram.com/ridwanhrDan follow juga akun Instagram @autonetcare dihttps://www.instagram.com/autonetcareDan AutonetCare Detailing dihttps://www.instagram.com/autonetcare.detailingKalau kamu ingin sewa mobil di jakarta bisa ke autonet rent car dihttp://www.autonetrentcar.com"
"Rsq7EY7vhgI",":)","2020-12-29T06:09:11Z","UCCuzDCoI3EUOo_nhCj4noSw","yb","24","21.04.01","reza arap|reza|rezaoktovian|arap|YB|indonesia|rewind","3432190","268064","9002","26443","https://i.ytimg.com/vi/Rsq7EY7vhgI/default.jpg","False","False","Main Video Link https://youtu.be/LhYfsKc0_tA"
"thhTUAXxegs","Gisel Mengakui Wanita Dalam Video Syur Itu Adalah Dirinya","2020-12-29T11:08:28Z","UCzl0OrB3-ehunyotIQvK77A","metrotvnews","22","21.04.01","medcomid|metrotvnews|berita viral|berita terkini|berita ter update|berita hari ini","2416517","24431","2702","9964","https://i.ytimg.com/vi/thhTUAXxegs/default.jpg","False","False",""
"_0-kP96easE","ANIMASINOPAL SPESIAL TAHUN BARU 2021","2020-12-31T11:16:04Z","UC5IA7MpYcbhbA28RgyQrV0A","animasinopal","23","21.04.01","[none]","1074537","57471","1270","4487","https://i.ytimg.com/vi/_0-kP96easE/default.jpg","False","False","#animasinopal #sinopal #cutegirlSUSUREPRIS! jangan lupa subscribe channel animasinopal ya 🔥INSTAGRAM:https://www.instagram.com/si_nopal/FACEBOOK:https://m.facebook.com/animasinopalpage/E-MAIL: kontaksinopal@gmail.com"
"8likTGN2LxM","SI DIA...","2020-12-28T10:00:11Z","UCXkRFUruW9lg4hEBILMVkPQ","Korea Reomit","22","21.04.01","Korea Reomit|Jang Hansol|Medok|Orang Korea Yang","3409810","298816","4062","39577","https://i.ytimg.com/vi/8likTGN2LxM/default.jpg","False","False","📌 Instagram:https://www.instagram.com/hansoljang110/💼Bisnis enquiries/비즈니스 문의:koreareomit@gmail.com🛒Korea Reomit Official Merchandise Store🛍️:https://www.tokopedia.com/korea-reomit#KoreaReomit"
"NT1imJpsUqE","DJ ADUH MAMAE ADA COWOK BAJU HITAM BIKIN SAYA TERPANAH VIRAL TIK TOK ( DJ DESA Remix )","2020-12-29T15:00:11Z","UCzc0SCcUmnAJvUMHs4Q6bMA","DJ DESA","10","21.04.01","dj cowok baju hitam|dj ada cowok baju hitam|dj ada cowok baju hitam viral tik tok|dj cowok baju hitam slow|dj tik tok cowok baju hitam|dj cowok baju hitam viral|dj cowok baju hitam tik tok|dj remix cowok baju hitam|remix cowok baju hitam tik tok|cowok baju hitam viral tik tok|dj nona|dj gadis baju merah ade la muhu|dj gadis baju merah|dj gadis baju merah viral tik tok|dj gadis baju merah dj desa|dj nona gadis baju merah dj desa|dj terbaru 2021|dj isky riveld","1326549","30618","1653","1800","https://i.ytimg.com/vi/NT1imJpsUqE/default.jpg","False","False","DJ from INDONESIA🇮🇩--------------------------------------------------------------Follow Isky Riveld :Instagram : https://www.instagram.com/iskyriveld_/Facebook : https://www.facebook.com/isky.rvldFollow DJ DESA :Instagram : https://www.instagram.com/djdesaoffic...#DJAdacowokbajuhitam #RemixTikTok #DJDESA #djtiktok Thanks for watching :)"
"SKxicfdYmXk","Viral Dinikahi Pria Afrika, Di Kampung Suaminya Ia Diperlakukan Bak Puteri","2021-01-02T04:44:08Z","UCC-YG6gBZNmdxYfQZnwCX4A","Serambi on TV","25","21.04.01","serambiontv|serambinews|serambiindonesia|acehnews|kabaraceh|beritaaceh|acehtv|bandaaceh|Berita Aceh Terkini|Breaking News Aceh|Kompas TV|Video Viral Aceh|Aceh Viral|Video Serambi Indonesia|Tribunnews Aceh|Aceh Tribunnews|Serambi TV|News|WANITA ASIA NIKAH DENGAN PRIA AFRIKA|PRIA AFRI|WANITA INI DIPERLAKUKAN BAK PUTERI|PULANG KAMPUNG SUAMI|WANITA MALAYSIA|MALAYSIA","508087","4180","326","871","https://i.ytimg.com/vi/SKxicfdYmXk/default.jpg","False","False","BACA SELENGKAPNYA: https://bit.ly/2XfCjbfSERAMBINEWS.COM  - Sempat viral seorang gadis cantik bernama Nur Afilah menikah dengan pria Afrika bernama Mohammed Camara.Setelah satu tahun berlalu, rumah tangga Nur Alifah dan Adama Mohammed Camara tampak begitu bahagia.Bahkan Nur Alifah sempat diboyong ke kampung halaman sang suami di Afrika.Tak disangka, kedatangan Nur Alifah ke kampung halaman Adama Mohammed Camara disambut dengan begitu meriah.Lewat akun Instagramnya Nur Alifah mengaku diperlakukan bak seorang puteri raja di kampung halaman sang suami.Tak hanya bahagia hidup bersama Adama Mohammed Camara, Nur Alifah juga kini terlihat makin modis.Wanita cantik asal Malaysia ini makin tenar sebagai selebgram.Sah menjadi istri Adama, Alifah sempat diboyong ke Afrika.Bertemu dengan ibu mertua dan saudara sang suami, Alifah mengaku begitu disambut baik.Bahkan ia bercerita diperlakukan keluarga suami bak seorang puteri raja.Keramahan keluarga suami nyatanya membuat Alifah begitu merindukan mereka.Rindu jugak kt sna sebenarnya, sbb dilayani mcm puteri kt sni sapa nak layan mcm puteri kt hg, tulis Alifah dikutip TribunStyle.com, Sabtu (2/1/2021).Baca berita lainnya di http://serambinews.com/"
"pQkWLwpiljM","EKSKLUSIF : RIZKY BILLAR TERNYATA SELAMA INI...","2020-12-30T08:09:28Z","UCFxxxYyYQtRAuIyW-o6PbEQ","PUTRA SIREGAR MERAKYAT","24","21.04.01","RIZKY BILLAR|PODCAST|PUTRA SIREGAR|PUTRA SIREGAR MERAKYAT|IPHONE 12|PS5 GRATIS|PSTORE|QCELL|ISTIQOMAH CELL","906984","67648","1708","20211","https://i.ytimg.com/vi/pQkWLwpiljM/default.jpg","False","False","LESLAR HARUS NONTON Hanya di PS STORE | HP PEJABAT HARGA MERAKYAT WAJIB FOLLOW INSTAGRAM DI BAWAH : PSTORE_JAKARTA : https://www.instagram.com/pstore_jakartaPSTORE_BEKASI : https://www.instagram.com/pstore_beka...PSTORE_BATAM     : https://www.instagram.com/pstore_batamPSTORE_TANGERANG : https://www.instagram.com/pstore_tang...PSTORE_BANDUNG : https://www.instagram.com/pstore_bandungPSTORE_CIAMIS : https://www.instagram.com/pstore_ciam...PS.STORE_PEKANBARU : https://www.instagram.com/ps.store_pe...PS.STORE_MEDAN : https://www.instagram.com/ps.store_medanPSTORE_JOGJAKARTA : https://www.instagram.com/pstore_jogj...PSTORE_SURABAYA : https://www.instagram.com/pstore_sura...ISTIQOMAH JAKARTA :https://www.instagram.com/istore_jaka...ISTIQOMAH DEPOK : https://www.instagram.com/istore_depo...LAPTOPSSS : https://www.instagram.com/laptopsss/?...TVSTORE : https://www.instagram.com/laptopsss/?...AHHASTOREJKT : https://www.instagram.com/ahhastorejk... ======================================= Jika Anda Suka Silahkan Like dan Juga bantu Subscribe Channel Kita dengan cara Like Comment and SUBCRIBE..!! INGAT INSTAGRAM kita yang slalu live hanya di atas ini :INGAT SEBELUM TRANSFER INGAT KITA CUMAN PUNYA SATU REKENING PERUSAHAAN YAITU REKENING MANDIRI A/N : PT.PUTRA SIREGAR MERAKYATNO.REK                                : 109-00-5507-707-7INGAT SELAIN NOMOR REKENING INI KAMI TIDAK DAPAT MELAYANI ANDA. HATI - HATI PENIPUANKITA JUGA MENYEDIAKAN PENJUALAN ONLINE  LINK NYA DIBAWAH INI :SHOPEE          : http://shopee.co.id/pstore_------------------------------------------------"
"KDYnNC2G1Ws","HAPPY ASMARA - WES TATAS (Official Live Music Video)| Layangan Sing Tatas Tondo Tresnoku Wes Pungkas","2021-01-01T08:00:12Z","UCqcH6VSGv95siQHyKhyqVhQ","Happy Asmara Music","10","21.04.01","[none]","447321","15053","220","4594","https://i.ytimg.com/vi/KDYnNC2G1Ws/default.jpg","False","False","Executive Producer : Happy RismMUSIC PRODUCTIONSongwriter: Vicky Prasetyo x Happy RismVoc : Happy AsmaraMusic by : Music Interactive  https://instagram.com/musicinteractiv..Location : Luv Kitchen Lounge KediriLirik 'WES TATAS':Tak Eleng-eleng mbiyen tau ngomong opoArep ngancani aku tekan pungkase umurkuNanging saikine kowe ninggal janjineIbarat banyu mili wes tekan segoroCubo dadi aku kuat po atimuMesti kowe sambat ora kuatAku uwes ora pengen laraAtiku wes tenang Wes tak anggep ilangReff : Layangan sing tatasTondo tresnoku wis pungkasMabur duwur ngalang-alang Yen nibo dadi kenanganKowe sing tak eman-emanNinggalke roso kelaranOpo iki wes takdireAku ikhlas aku pasrahWes tak ngalah..#HappyAsmara #Pashati #westatasCopyright © 2020, HappyAsmaraMusic [Official Video]Terima kasih anda sudah mampir di channel AkuJangan lupa untuk klik Like, Comment, Share, dan Subscribe channel resmi Aku, juga klik gambar lonceng agar anda dapat info video-video terbaru rilisan Akuselengkapnya kunjungi kami di:Channel :    https://www.youtube.com/c/HappyAsmara...Instagram : https://www.instagram.com/happy_asmara77Facebook  : https://www.facebook.com/happy.risman...fanspage :https://www.facebook.com/Happy.asmara...========================================Licensed to YouTube by IDE (Music)This channel & Video optimized by IDE OptimizationLicense your music here: https://smarturl.id/idemusicOptimize your video now: https://smarturl.id/optimize"
"3lpNZWv3Aoo","Terima kasih 2020.","2020-12-31T16:03:46Z","UCDs47Uey2EitsrMaPxDXXkw","Karin Novilda","22","21.04.01","[none]","1143952","119883","746","4135","https://i.ytimg.com/vi/3lpNZWv3Aoo/default.jpg","False","False",""
"T9VKmy6RyJc","Pemerintah Resmi Tetapkan FPI Ormas Terlarang","2020-12-30T06:29:44Z","UCzl0OrB3-ehunyotIQvK77A","metrotvnews","22","21.04.01","medcomid|metrotvnews|berita viral|berita terkini|berita ter update|berita hari ini","1142206","23526","6569","17719","https://i.ytimg.com/vi/T9VKmy6RyJc/default.jpg","False","False","Menkopolhukam, Mahfud MD menyampaikan sikap pemerintah terdapat organisasi FPI dan melarang setiap kegiatan FPI serta membubarkan FPI. Pemerintah melarang setiap kegiatan FPI karena mulai hari ini (30/12) FPI tidak punya legal standing. Keputusan ini juga diteken oleh enam menteri yakni, Mendagri, Menkominfo, Kepala BNPT, Jaksa Agung, Menkumhan dan Kapolri."
"VfK3ov22ujM","CHIKA VIRAL DI TIKTOK • KOK BUKAN DITA KERANG❓","2020-12-30T06:32:57Z","UCxvwscmR_VAfBY-ZI2VGuKw","dunia MANJI","24","21.04.01","dunia manji|anji manji|vlog anji|chikakiku|chika tiktok|joget doang viral|bakat lain chika tiktok|joget papi chulo chika tiktok|goyang papi chulo|candrika sari jusman|candrika chika|dita kerang tiktok","1056827","31841","1432","4459","https://i.ytimg.com/vi/VfK3ov22ujM/default.jpg","False","False","Siapa sih sebenarnya Candrika (Chika) Sari Jusman, sosok yang viral di tiktok joget papi chulo?"
