video_id,title,publishedAt,channelId,channelTitle,categoryId,trending_date,tags,view_count,likes,dislikes,comment_count,thumbnail_link,comments_disabled,ratings_disabled,description
"nCePxEJvRUs","EKSKLUSIF: Kesaksian Laskar FPI dalam Rombongan Rizieq Syihab (Part 1) | Mata Najwa","2020-12-16T23:00:49Z","UCo8h2TY_uBkAVUIc14m_KCA","Najwa Shihab","25","21.04.01","mata najwa|najwa shihab|narasi|trans 7|fpi|ormas|polisi|kontroversial|front pembela islam|rizieq syihab|laskar fpi|rombongan rizieq|rizieq ditangkap|rizieq ditahan|islam|agama|kekerasan|sara|isu sara|isu agama","6840538","122622","12193","36021","https://i.ytimg.com/vi/nCePxEJvRUs/default.jpg","False","False","Silang Versi FPI-Polisi (Part 1)Di Mata Najwa, seorang anggota Laskar FPI menceritakan apa yang dialaminya ketika mengawal pimpinan FPI Rizieq Syihab pekan lalu. Pengawalan ini berujung maut bagi 6 orang rekannya.Keenamnya tewas ditembak aparat kepolisian yang mengintai pengawalan tersebut. Anggota Laskar FPI ini dikatakan membawa senjata api dan senjata tajam. Aparat disebut membela diri.Sekretaris Umum FPI Munarman membantah bila anak buahnya dilengkapi senjata.“Saat itu tidak ada sama sekali yang bawa senjata. Kita cek laskar yang masih hidup, ke keluarga (rombongan). Saya juga pernah dikawal laskar,” kata Munarman.#MataNajwa #kapalapi(Narasi)Tonton juga Mata Najwa eps. [Silang Versi FPI-Polisi] dan episode lainnya di https://www.narasi.tv atau klik link di bawah.Part 1 - https://bit.ly/3nx65UoPart 2 - http://bit.ly/2Wm7gKfPart 3 - https://bit.ly/2Ly2XcvPart 4 - http://bit.ly/3gRTLLRPart 5 - https://bit.ly/3nvLakoPart 6 - https://bit.ly/2K9uOPSPart 7 - http://bit.ly/3mtRffMJangan lupa subscribe, tinggalkan komentar dan share.Tonton konten lainnya juga di YouTube Channel:- Narasi http://bit.ly/SubscribeYouTubeNarasi- Narasi Newsroom http://bit.ly/SubscribeNarasiNewsroom- Narasi Entertainment http://bit.ly/SubscribeYTNarasiEntertainment- Narasi Stories http://bit.ly/SubscribeNarasiStories- Narasi Talks http://bit.ly/SubscribeNarasiTalks- Narasi Sports http://bit.ly/SubscribeNarasiSportsJangan lupa subscribe yaa..Follow:https://www.instagram.com/najwashihabhttps://twitter.com/NajwaShihabhttps://www.facebook.com/najwashihabofficial"
"FxpNzTcn0vY","EKSKLUSIF: Percakapan Terakhir Laskar FPI sebelum Tewas (Part 2) | Mata Najwa","2020-12-16T23:01:07Z","UCo8h2TY_uBkAVUIc14m_KCA","Najwa Shihab","25","21.04.01","mata najwa|najwa shihab|narasi|trans 7|fpi|polisi|laskar fpi|laskar fpi tewas|kekerasan|kontroversial|eksklusif|agama|islam|isu agama|isu sara|rizieq syihab|rizieq ditangkap|rizieq ditahan","4854417","68808","6135","26631","https://i.ytimg.com/vi/FxpNzTcn0vY/default.jpg","False","False","Silang Versi FPI-Polisi (Part 2)Anggota Laskar FPI merekam percakapan terakhirnya dengan rekannya yang menumpang mobil Chevrolet Spin. Para Laskar FPI di mobil itulah yang kemudian dinyatakan pihak kepolisian diamankan anggotanya, namun karena melawan, aparat kepolisian menembak mereka. Anton Charlian, politikus PDIP yang juga mantan Kapolda Jawa Barat, menyebut polisi bisa melakukan tindakan tegas terukur karena dirinya terancam.Tapi, Anton mengingatkan penembakan ini perlu didalami lebih lanjut, Kita perlu dalami dan telusuri.#MataNajwa #kapalapi(Narasi)Tonton juga Mata Najwa eps. [Silang Versi FPI-Polisi] dan episode lainnya di https://www.narasi.tv atau klik link di bawah.Part 1 - https://bit.ly/3nx65UoPart 2 - http://bit.ly/2Wm7gKfPart 3 - https://bit.ly/2Ly2XcvPart 4 - http://bit.ly/3gRTLLRPart 5 - https://bit.ly/3nvLakoPart 6 - https://bit.ly/2K9uOPSPart 7 - http://bit.ly/3mtRffMJangan lupa subscribe, tinggalkan komentar dan share.Tonton konten lainnya juga di YouTube Channel:- Narasi http://bit.ly/SubscribeYouTubeNarasi- Narasi Newsroom http://bit.ly/SubscribeNarasiNewsroom- Narasi Entertainment http://bit.ly/SubscribeYTNarasiEntertainment- Narasi Stories http://bit.ly/SubscribeNarasiStories- Narasi Talks http://bit.ly/SubscribeNarasiTalks- Narasi Sports http://bit.ly/SubscribeNarasiSportsJangan lupa subscribe yaa..Follow:https://www.instagram.com/najwashihabhttps://twitter.com/NajwaShihabhttps://www.facebook.com/najwashihabofficial"
"vK3WkdeuCZY","Penolong Yang Setia - Melitha Sidabutar [Official Music Video]","2020-12-23T14:00:10Z","UCrLp5XWCXQHJnmK8P36KTsQ","impactmusik indonesia","10","21.04.01","impact music|lagu rohani kristen|lagu penyembahan terbaru|pujian penyembahan terbaru 2020|lagu rohani terbaru|20 lagu rohani|pujian dan penyembahan terbaru|best lagu rohani|christian songs|nonstop lagu rohani 2020|christian song|yesus","584378","66061","317","7591","https://i.ytimg.com/vi/vK3WkdeuCZY/default.jpg","False","False","Penolong Yang SetiaMelitha Sidabutarhari ini kita mempersiapkan masuk ke tahun 2021. kiranya damai sejahtera dan kasih karunia Tuhan Yesus menyertai kita semua, memasuki tahun 2021. Melitha sejak kecil melayani Tuhan bersama seluruh keluarganya di Bekasi,. suka dan duka mereka hadapi tanpa pernah melepaskan Tuhan Yesus dan pelayanan di gereja. Beberapa waktu lalu saudara kembar dari Melitha dipanggil Tuhan..saat mengikuti sebuah ajang kompetisi menyanyi di TV. Dalam kepedihan hati yang mendalam,Melitha masih berkata kepada Tim Impact  bahwa Tuhan Yesus baik & tak merancang yg buruk walau air mata menggenang di pipinya. Kakak rohani nya, Ms Fanny Hamasaki terus  menguatkan Melitha untuk dapat mulai membuat album rohani bagi Tuhan Yesus. ( be strong Melitha ..)semoga lagu ini menguatkan teman teman sekalian yang menonton, semoga lagu ini mengingatkan teman teman yang menghadapi hal hal tak mudah, Bahwa Tuhan tetap baik dan IA tak merancangkan yang buruk. tetap pegang Tuhan Yesus, dan bersyukur kita akan memasuki 2021dan mohon support untuk Melitha( impact Music )Subscribe Channel ini, klik disini http://bit.ly/impactmusikLIKE, COMMENT dan juga SHARE Channel Impact MusicInstagram : http://bit.ly/ImpacmusiktIGFB: http://bit.ly/FBImpactMusikTik Tok: http://bit.ly/TikTokImpactwa Impact: 0818 782 199Lirik:Saat kuberjalan / when i walkKasihMu menerangi langkahku/ your love shine my stepsTak kutakut, Tak kubimbang/ im not afraid and worriedKarn’na kutau Kau bersamaku/ I know you are with meReff:Kau lebih tahu  yang terbaik bagiku / you know what the best for meKau lebih sanggup pulihkan hidupku/ you are capable of restoring my lifeKuberserah, kupercaya / i surrender, I trust youHanya Yesus penolong yang setia/ Jesus you are my very present help in troubleProducer : Alberd Tanonisong Composed : Ronald Pangemanan orchestra & Arrangement: Alberd Harmonic Orchestravocal coach : Maria Priscilladrum : Samuel GunawanMix master : Rangga SatrianaVideo : Clement Moningka℗ & © Impact Music 2020#lagurohaniterbaru #laguimpactmusic #lagubaru2021 #melitha"
"AkcMtjr_lLc","Menyoal Tewasnya 6 Laskar FPI!","2020-12-21T10:15:00Z","UCuMAjEaSMj7q7YLf0xW1MjQ","detikcom","25","21.04.01","detikcom|20detik|Menyoal|Tewasnya|6 Laskar|FPI|corona|hijriyah|psbb|lockdown|Tribun|kompas|mnc|cnn indonesia|transmedia|transtv|trans7|net|netmediatama|netizen|kumparan|liputan6","1003490","8462","1186","3132","https://i.ytimg.com/vi/AkcMtjr_lLc/default.jpg","False","False","https://20.detik.com/drooftalk/20201216-201217002/menyoal-tewasnya-6-laskar-fpiBareskrim Polri telah memeriksa 78 saksi dalam kasus penyerangan petugas. Selain itu, 7 orang ahli juga telah diperiksa dalam kasus yang mengakibatkan 6 laskar FPI tewas itu.Perkembangan terkait penanganan 6 orang yang meninggal dunia. Karena saat ini yang masuk di Bareskrim Polri adalah laporan penyerangan terhadap petugas. Maka perkembangannya sampai hari ini kita sudah memeriksa 78 orang saksi dan 7 orang ahli, kata Kabareskrim Polri, Komjen Listyo Sigit Prabowo dalam jumpa pers di Mabes Polri, Jakarta, Senin (21/12/2020).Komjen Sigit mengungkapkan, dari 78 saksi yang diperiksa, 37 di antaranya merupakan saksi yang berada di tempat kejadian perkara (TKP) di KM 50 Tol Jakarta-Cikampek.Kemudian 37 orang saksi tersebut dari KM 50. 22 saksi lain yang ada di sekitar, ujarnya.Selain itu, 4 orang yang diperiksa merupakan saksi korban. Sementara, 12 lainnya merupakan petugas yang berada di TKP.Kemudian ada 4 orang yang saat ini menjadi saksi korban 12 petugas yang ada di lokasi KM 50 kemudian 3 orang petugas dari Rumah Sakit Polri, kata Komjen Sigit.Sementara, dari 7 ahli yang diperiksa, 2 di antaranya merupakan ahli dari Pusat Laboratorium Forensik (Puslabfor). Kemudian, 3 ahli dari kedokteran forensik, 1 ahli dari siber dan 1 ahli pidana.Dua ahli dari Puslabfor, tiga ahli dari kedokteran forensik, satu ahli dari cyber, satu ahli pidana, ungkapnya.Komjen Sigit mengungkapkan, selain memeriksa saksi-saksi, Bareskrim juga menyita CCTV yang ada di TKP. Bareskrim, kata dia, juga telah melakukan rekonstruksi ulang peristiwa dugaan penyerangan terhadap polisi oleh 6 laskar FPI yang tewas.Dan saat ini kita sedang menganalisa dan menyita CCTV yang ada. Rekonstruksi sudah kita lakukan beberapa waktu yang lalu dan tentunya dalam kesempatan ini sekali lagi saya sampaikan bahwa kami dari Bareskrim Polri membuka ruang apabila ada masyarakat atau saksi-saksi yang mengetahui secara langsung untuk memberikan masukan atau menjadi saksi, tutur Komjen Sigit.Ayo tonton dan share detik ini juga!click our website :- detikcom: https://www.detik.com- 20detik: https://20.detik.comFollow official account detikcom di:- Twitter: https://twitter.com/detikcom- Instagram detikcom: https://instagram.com/detikcom- Instagram 20detik: https://www.instagram.com/20detik/- Facebook detikcom: https://www.facebook.com/detikcom- Facebook 20detik: https://www.facebook.com/20detik"
"kgMBxik27zQ","BAKU HANTAM THE DARK CHEF INDONESIA! PART 1","2020-12-16T11:30:12Z","UCr5k1iu1hF_01O1AD1JzcFA","Arnold Poernomo","24","21.04.01","Arnold Poernomo|Chef Arnold|Cooking|Master Chef|Resep|Menu Rahasia|bobon santoso|tretan muslim|coki pardede|harta tahta renatta|renatta|battle masak|the santoso|the dark chef indonesia|trending|viral|chef arnold marah|pemuda tersesat|The biggest cooking battle on YouTube|video panas|masak|menu|mudah|enak|cepat|tutorial masak|resep rahasia|goblokers|bobon the next masterchef|coki muslim","5603261","279141","7295","17988","https://i.ytimg.com/vi/kgMBxik27zQ/default.jpg","False","False","Yang sudah kalian tunggu-tunggu! The First & The Biggest Cooking Battle On Youtube! Akan menjadi pertarungan masak terpanas dari baku hantam The Real Dark Chef Indonesia Tretan Muslim & Bobon Santoso yang menantang Chef tersombong berskill dengan dikawal Coki Pardede! Tonton sampai habis!Tonton Part 2 nya disini : https://youtu.be/2SDFM0gF1tUTretan MuslimChannel YT :@Tretan Universe Instagram : @tretanmuslimCoki Pardede :Channel YT :@Coki Pardede Instagram : @cokipardede666Bobon SantosoChannel YT :@The Santoso Instagram : @bobonsantosoChef Renatta MoeloekInstagram : @renattamoeloekKaesangChannel YT :@Kaesang Instagram : @kaesangpRius VernandesChannel YT : @Rius Vernandes Instagram : @rius.vernandesAndy & Victor JWestBrosChannel YT : @JWestBros Instagram : @JWestBros @garciandyyy @vic.sam#ArnoldPoernomo #TheBiggestCookingBattle #VideoPanas Like Subs Dislike bla bla Karepmuhttps://smarturl.it/ArnoldPoernomoCatch us on SNS :https://www.instagram.com/arnoldpo/Official Site: https://starhits.id/Don't reupload our content but you can share our video.Production 2020 © Copyrights & Trademark by StarHits"
"C3vj-CVBOZQ","PECAH! Abdur Roasting Kiky Saputri: Kau Tanah Pejabat atau Simpanan Pejabat? - COMEDY LAB (Bag 5)","2020-12-25T16:22:09Z","UC8zZ084em5pohjs6kk2Bpaw","Stand Up Kompas TV","25","21.04.01","comedy lab|abdur roasting kiky saputri|roasting kiky saputri|abdur|komika abdur|suci|suci kompas tv|boris bokir|kiky saputri|Rizhky Nurasly Saputri","930850","17025","349","601","https://i.ytimg.com/vi/C3vj-CVBOZQ/default.jpg","False","False","JAKARTA, KOMPAS.TV - Comedy Lab SPECIAL LIBURAN yang dipandu Gita Bhebhita dan Boris Bokir menghadirkan sejumlah komika dan bintang tamu.Mereka adalah Kiky Saputri, Abdur, Teuku Rizky, dan Rahmet. Pada segmen kali ini, Abdur akan me-roasting Kiky Saputri. Seperti apa penampilannya?______________________________________________________________KompasTV merilis sebuah program komedi baru untuk menemani penonton setia KompasTV, yaitu sebuah comedy show bersama para komika dengan mengeksplorasi Stand Up Comedy.Suasana Comedy Lab bersifat chill dan intimate serta dengan suguhan komedi segar dan menghibur. Penampilan Stand Up Comedy ini dilakukan oleh komika-komika Indonesia dengan didampingi oleh Host Gita Bhebita dan Boris Bokir.Bintang tamu yang hadir pun selalu berbeda setiap episodenya. Selanjutnya, variety show ini tayang setiap dua kali dalam seminggu dengan durasi satu jam.Harapannya, Comedy Lab yang dikemas berbeda dengan eksplorasi bebas dari para komika dapat menjadi program hiburan alternatif yang dapat dinikmati bersama keluarga.Comedy Lab tayang setiap hari Jumat pukul 22.00 WIB dan Minggu pukul 18.00 WIB hanya di Kompas TV.Jangan lupa untuk follow Instagram @comedylabkompastv dan jangan lupa subscribe channel YouTube Stand Up KompasTV ya!#ComedyLab #Comlab #Komedi"
"FpJlLxTXhS8","Apakah Orang Buta Warna Dapat Melihat Api Neraka? | Pemuda Tersesat Eps 07 - Season 02","2020-12-21T13:15:01Z","UC15VpzK4og3NLmCVZQOroFw","Majelis Lucu","23","21.04.01","majelis lucu indonesia|majelis lucu|standup|standup comedy|tretan muslim|coki pardede|adriano qalbi|patrick effendy|comic|open mic|goblok|joshua suherman|dono pradana|ananta rispo|rigen rakelna|abdur arsyad|dani aditya|ngakak|sensor|hiya|golongan kami|umat lucu|MLI|SUCI|SUCA|komika|standup comedian|dustin tiffani|priska baru segu|pemuda tersesat mli|pemuda tersesat 666|kultum pemuda tersesat mli|habib husein jafar","1209455","61514","1142","6913","https://i.ytimg.com/vi/FpJlLxTXhS8/default.jpg","False","False","Tulis pertanyaan kalian di kolom komentar dan dapatkan giveaway gratis untuk kalian yang PALING TERSESAT !!!Sosial Media :Tretan Muslim : https://www.instagram.com/tretanmuslim/Coki Pardede : https://www.instagram.com/cokipardede666/Habib Husein : https://www.instagram.com/husein_hadar/Merchandise & Liquid MLI : https://www.tokopedia.com/mlimerchandise https://www.shopee.co.id/mlimerchandise-------Terima Kasih, dengan menonton video ini, anda sudah membuat kami lebih kaya sedikit! Jangan lupa sebarkan, like dan SUBSCRIBE... Jadilah bagian dari komedi Indonesia yang sudah pasti Lucu...https://www.majelislucuindonesia.com"
"RsEDn0UTFL4","MAIN KERUMAH MAS BAIM, GAK SENGAJA KETEMU ORANG YANG BISA 7 BAHASA !!!","2020-12-20T13:08:53Z","UCl4xqaNzEV0XqCdTWfhXfNg","MARSHA OZAWA","24","21.04.01","MLBB|MOBILE LEGENDS|MARSHA|OURA|JESSNOLIMIT|LEMON|DONKEY|KAESANG|BRANDONKENT|KIDO|WATT|JEEL|YOR|RAJABARONG|RAJABABI|RAJAMATI|MPL|MSC|PIALAPRESIDEN|TIMNAS|SEAGAMES|ESPORTS","2319212","87960","1582","4571","https://i.ytimg.com/vi/RsEDn0UTFL4/default.jpg","False","False","SEMOGA MENGHIBUR______________________________My Social Media instagram - https://www.instagram.com/steven.kurn...Follow My NIMO TV ID - https://www.nimo.tv/marshaofficial#GPX #GENGKAPAK #MARSHAOZAWA______________________________Don’t forget to subscribe, like and share guys."
"ZWzCAJQJaEg","MOBIL BUAT LIBURAN AKHIR TAHUN 2020","2020-12-26T12:00:21Z","UCyxFLIrNfV8B3cN4KgQL6sA","Fitra Eri","2","21.04.01","[none]","487554","11099","339","860","https://i.ytimg.com/vi/ZWzCAJQJaEg/default.jpg","False","False","Saya ajak Anda melihat mobil yang saya gunakan untuk berlibur akhir tahun 2020."
"FngYpWfdE_w","[MV] 우주힙쟁이 - 한량 (feat. 비비(BIBI)) (prod.딘딘)","2020-12-26T14:01:07Z","UCOHM2N1YQdb-cHWxJxwBMLQ","아는형님 Knowingbros","24","21.04.01","아는 형님|형님|형님 학교|김희철|민경훈|비비|딘딘|에이티즈|우주힙쟁이|한량|뮤비|뮤직비디오|아형방과후활동|방과후활동|첫공개|단독공개|슈퍼주니어|버즈|Knowing bros|Knowing brother|min kyung hoon|kim hee chul|kpop|BIBI|DinDin|ATEEZ","3487020","305924","1711","26443","https://i.ytimg.com/vi/FngYpWfdE_w/default.jpg","False","False","[MV] 우주힙쟁이 - 한량 (feat. 비비(BIBI)) (prod.딘딘) #아는형님 #우주힙쟁이 #한량"
"Q7MR4_uw91w","TANTANGAN PANAS VS DINGIN   Cewek Dingin Vs Panas! Siapa yang TAHAN oleh KABOOM!","2020-12-19T08:00:10Z","UCqbFJDenwz9jTtz8MrLhx3g","KABOOM! Indonesian","24","21.04.01","Kaboom!|Kaboom Indonesia|Tantangan|tantangan panas vs dingin troom troom bahasa indonesia|tantangan panas vs dingin|panas|dingin|panas vs dingin|cewek dingin vs panas|123go|lucu|tantangan|123go Indonesia|Indonesia|ka boom|situasi lucu|challenge|cold vs hot|dingin vs panas|5 minute crafts|food|funny|situation|troom troom|makan|#KaboomIndonesia|Tantangan Lucu|siapa yang tahan|Cewek Dingin Vs Panas!|TANTANGAN PANAS VS DINGIN","1602276","10000","2084","926","https://i.ytimg.com/vi/Q7MR4_uw91w/default.jpg","False","False","Hai guys! Kamu suka panas? Atau suka dingin? Ini dia tantangan Panas vs Dingin yang penuh dengan situasi lucu dan momen canggung yang, kagetnya nih, semua orang bisanyambung! Bikin sarapan, yoga, dan bahkan pergi kencan terlihat agak beda kalau cewe api dan cewe es terlibat! Tonton terus video tantangan lucu ini dan lihat siapa yang bakal menang tantangan api vs es yang epik oleh KABOOM!Kalau kamu suka video ini, kamu mungkin juga suka ”TANTANGAN WARNAMERAH VS BIRU! Makan Makanan Satu Warna 24 Jam Penuh Oleh KABOOM” https://youtu.be/uetzayf4OmcSuka lagu yang kami pakai di video ini? Kamu bisa temukan lagu kami di EpidemicSound:https://bit.ly/2JcUlBaSodaYogaKencanMakan SarapanMandi berendamDapat F Di KelasBlooper#PANASvsDINGIN #TantanganLucu #KaboomIndonesia"
"JLPpztKM0-k","TANTANGAN BAWA MAKANAN KE MANA SAJA || Yang TERAKHIR Makan Menang! Prank Kocak oleh 123 GO! BOYS","2020-12-21T10:00:47Z","UCmWPgDvrvP_svfJ1F40L3Vw","123 GO! BOYS Indonesian","26","21.04.01","123go|cowok|kiathidup|lucu|123goboys|diy|prank|tantangan|123go!boys","1166335","10546","1588","463","https://i.ytimg.com/vi/JLPpztKM0-k/default.jpg","False","False","Kamu yakin bisa menjadi penyelundup makanan paling jago?Dengan kiat-kiat di video ini, kamu bisa menjadi masternya.Mau tahu sehebat apa dirimu? Cobalah salah satu trik kami saat mencoba menyelundupkan sesuatu. Bagikan video ini dengan teman-temanmu dan buatlah rencana rahasia bersama-sama!Subscribe channel YouTube kami supaya kamu tidak pernah ketinggalan video seru lainnya!#DIY #123GO #tantanganBerlangganan: https://bit.ly/2yuvmtUMusik oleh Epidemic Sound: https://www.epidemicsound.com/Materi stok: https://www.depositphotos.com https://www.shutterstock.comVideo ini ditujukan sebagai hiburan. Kami tidak menjamin kelengkapan, keamanan, dan kelayakan apa pun. Segala tindakan yang dilakukan berdasarkan informasi di video ini akan sepenuhnya menjadi risiko pelaku, dan kami tidak akan bertanggung jawab atas segala kerusakan dan kehilangan. Pemirsa bertanggung jawab penuh untuk menilai, merawat, dan melakukan tindak pencegahan jika berencana untuk meniru.Video berikut ini mungkin menampilkan aktivitas yang dilakukan oleh aktor-aktor kami dalam lingkungan terkendali - mohon bertindak penuh pertimbangan, kewaspadaan, dan kehati-hatian apabila hendak meniru."
"L5OmUSypkFc","RICIS BATAL PERGI KE ACEH.. Pernikahan Chacha & Andre Banjir Air Mata!!!","2020-12-22T06:00:06Z","UC4tS4Q_Cno5JVcIUXxQOOpA","Ricis Official","24","21.04.01","riaricis|squishy|mainan|hijab|vlog|slime|lol|lolsurprise|funny|ngakak|kocak|lucu|viral|trending|indonesia|daily|rumah|ricis|sahur|buka puasa|ramadhan|ramadan|food|maghrib|taraweh|beauty|religi|ngabuburit|bukber|saur on the road|takjil|imsak|takbiran|makeup|challenge|makanan|tim ricis|romadon|stayhome|stayathome|home","3558953","273592","1896","17305","https://i.ytimg.com/vi/L5OmUSypkFc/default.jpg","False","False","nonton juga https://youtu.be/Vgq3DopYxK0Contact business : ricismanagement@gmail.comSubscribe RUMAH RICIShttps://www.youtube.com/channel/UCNrN1jrDHKE4lCD-BKa9pog@riaricis1795https://www.instagram.com/riaricis1795@rumah.ricishttps://www.instagram.com/rumah.ricisHIJAB BY @ricisbykhayrahttps://www.instagram.com/ricisbykhayra"
"bdAHqXxsXMg","Heboh! Jembatan Bambu Senilai Rp200 Juta di Ponorogo, Jawa Timur - SIS 20/12","2020-12-20T08:09:49Z","UCrEtZcG9h9lx9oqQhros_Dg","Seputar iNews","25","21.04.01","Seputar iNews|Berita Terkini|Breaking News|TV Berita|Berita Indonesia|Info Indonesia|Special Report|Live Streaming|Hotman Paris Show|CNN Indonesia|Kompas TV|TV One|Metro TV|Mata Najwa|ILC|Full|jembatan sesak|jembatan bambu 200 juta|pupr ponorogo|bupati ponorogo|dprd ponorogo","1554003","14757","948","9985","https://i.ytimg.com/vi/bdAHqXxsXMg/default.jpg","False","False","Tanggal Tayang: 20/12/2020Embrionya adalah program Seputar Jakarta yang pertama mengudara pada 1 November 1989 dan menyajikan berbagai perkembangan utama di ibukota. Sejak itu Seputar iNews memperluas cakupan liputannya ke seluruh nusantara. Seputar iNews memiiki filosofi “apa kata dan bagaimana pengaruh bagi masyarakat”. Filosofi ini mendasari penyajian setiap berita sehingga dekat dan mudah dipahami oleh masyarakat.Subscribe iNews Official Youtube Channel:https://www.youtube.com/OfficialiNewsSubscribe Seputar iNews Youtube Channel:https://www.youtube.com/channel/UCrEtZcG9h9lx9oqQhros_DgFollow Our Official Twitter: https://twitter.com/SeputariNewsCheck Our Official Website: https://www.inews.idLike Our Official Facebook: https://www.facebook.com/SeputariNewsRCTIFollow Our Official Instagram:https://www.instagram.com/seputarinewsrctiSaksikan info berita terkini di:Seputar iNews Pagi: Setiap Hari Pukul 04.30 WIBSeputar iNews Siang: Setiap Hari Pukul 11.30 WIBSeputar iNews Malam: Senin – Jumat 01.00 WIBSeputar iNews: Senin – Jumat 09.00 | 11.00 | 13.00 | 14.00 | 18.00 | 23.00"
"bkQw-F1QTq4","TWICE 'CRY FOR ME' Choreography - 2","2020-12-21T14:59:48Z","UCzgxx_DM2Dcb9Y1spb9mUJA","TWICE","10","21.04.01","TWICE|트와이스|CRYFORME|크라이포미|TWICECRYFORME|트와이스크라이포미|TWICE크라이포미|CRYFORMETWICE|CRYFORME트와이스|크라이포미트와이스|크라이포미TWICE|TWICE디지털싱글|TWICEDigitalSingle|디지털싱글TWICE|DigitalSingleTWICE|트와이스디지털싱글|디지털싱글트와이스|트와이스신곡|TWICENewSong|신곡트와이스|NewSongTWICE|TWICE신곡|신곡TWICE|CRYFORMEDancePractice|CRYFORME안무|CRYFORME안무영상|CRYFORMEChoreographyVideo|CRYFORMEChoreography|CRYFORMEDance","9055237","518245","4767","27390","https://i.ytimg.com/vi/bkQw-F1QTq4/default.jpg","False","False","TWICE 'CRY FOR ME' Choreography - 2TWICE CRY FOR ME Released Online:https://twice.lnk.to/CRYFORMETWICE Official Shop: https://TWICE.lnk.to/ShopTWICE Official YouTube: http://www.youtube.com/c/TWICETWICE Official Facebook: http://www.facebook.com/JYPETWICETWICE Official Twitter: http://www.twitter.com/JYPETWICETWICE Official Instagram: http://www.instagram.com/TWICETAGRAMTWICE Official Homepage: http://TWICE.jype.comTWICE Official Fan's: http://fans.jype.com/TWICEⓒ 2020 JYP Entertainment. All Rights Reserved#TWICE #트와이스 #CRYFORME"
"SdFo1Ow9p0A","Pecah Banget Duet Ramanda & Kaka Slank Membawakan Terlalu Manis - Showcase 3 - Indonesian Idol 2021","2020-12-21T20:33:36Z","UCxcS3gOeEOdim7CwL9l0QvA","Indonesian Idol Special Season","10","21.04.01","Indonesian Idol|Indonesian Idol 2021|Juri|Ari Lasso|Judika|Rossa|Maia Estianti|Joy|Kelvin|Anggi|Made|Femila|Mega|Sharen|Mark|Azhardi|Melisa|Azka|Aldrin|Rimar|Kezia","3104231","0","0","5219","https://i.ytimg.com/vi/SdFo1Ow9p0A/default.jpg","False","True","Daniel meminta Ramanda untuk duet bareng Kaka Slank, langsung saja Kaka mengiakan tantangan dari Daniel. Tidak tanggung-tanggung Kaka bernyanyi diatas meja juri, membawakan lagu terlalu manis. Duet mereka berdua membuat suasana sangat pecah dan meriah.Nonton lagi Indonesian Idol Special Season lengkap di RCTI+ lewat link berikut ini: https://bit.ly/2IROp6FSubscribe now for more Indonesian Idol videos: https://bit.ly/IndonesianIdolLike Indonesian Idol on Facebook:http://www.facebook.com/IndonesianIdo...Follow Indonesian Idol on Twitter:http://twitter.com/IndonesianIdolDo You Have Instagram, follow us:www.instagram.com/indonesianidolid"
"UuAywk8a_w8","Parma 0-4 Juventus | Ronaldo Double & Morata Late Strike See Juventus Clinch Victory! | Serie A TIM","2020-12-19T22:45:25Z","UCBJeMCIeLQos7wacox4hmLQ","Serie A","17","21.04.01","Ronaldo|Juventus|Cristiano Ronaldo|calcio|parma juventus|parma juventus kulusevski|parma juventus ronaldo|parma 0 juventus 4|juventus 4 0 parma|cristiano ronaldo goal|CR7|cristiano ronaldo highlights juventus|cristiano ronaldo highlights|Serie A|highlights|Dybala|AC Milan|Inter Milan|Napoli|Roma|goals|full highlights|watch|migliori gol|migliori in campo|migliori al mondo|gol del mese|lukaku|Lazio|zlatan|ibrahimovic|Matchid=A||2020-21||UNICO||UNI||13||PARJUV","7898444","129524","3484","6046","https://i.ytimg.com/vi/UuAywk8a_w8/default.jpg","False","False","Goals from Cristiano Ronaldo, Alvaro Morata and Dejan Kulusevski claimed all 3 points for Juventus as they push towards the top of the table! | Serie A TIMThis is the official channel for the Serie A, providing all the latest highlights, interviews, news and features to keep you up to date with all things Italian football.Subscribe to the channel here! https://bit.ly/2OM2Eax Find out more about the Serie A at: http://www.legaseriea.it/en/ Questo è il canale ufficiale della Serie A, dove potrai avere accesso ai momenti salienti, alle interviste, alle notizie e alle funzionalità del momento per rimanere aggiornato sulle ultime novità del campionato.Iscriviti qui al canale! https://bit.ly/2OM2EaxPer maggiori informazioni sulla Serie A: http://www.legaseriea.it/it"
